{
   "ApplicationName":"all references test",
   "LoginApplicationName":"all_ref_test2",
   "DefaultLanguage":"en",
   "SystemDatasets":{
      "UsersDatasetDescriptor":{
         "Name":"Uživatelé",
         "Description":"Dataset s uživateli aplikace.",
         "PasswordAttribute":{
            "Name":"Password",
            "Description":null,
            "Type":"password",
            "Required":true,
            "Unique":null,
            "Safer":null,
            "Min":null,
            "Max":null
         },
         "Attributes":[
            {
               "Name":"Pozice",
               "Description":null,
               "Type":"username",
               "Required":true,
               "Unique":true,
               "Safer":null,
               "Min":null,
               "Max":null
            },
            {
               "Name":"Pozice2",
               "Type":"string"
            },
            {
               "Name":"Uživatel",
               "Type":"text",
               "Min":10
            },
            {
               "Name":"Uživatel2",
               "Type":"Uživatelé",
               "Required": true,
               "OnDeleteAction":"protect"
            }
         ]
      }
   },
   "Datasets":[
      {
         "Name":"342341}string",
         "Description":null,
         "Attributes":[
            {
               "Name":"Název pozice",
               "Type":"text",
               "Required": true
            }
         ]
      },
      {
         "Name":"url2",
         "Description":null,
         "Attributes":[
            {
               "Name":"Jméno měsíce",
               "Description":null,
               "Type":"text",
               "Required":true,
               "Unique":null,
               "Safer":null,
               "Min":null,
               "Max":null
            }
         ]
      },
      {
         "Name":"A-{35x}A",
         "Description":null,
         "Attributes":[
            {
               "Name":"Jméno měsíce",
               "Description":null,
               "Type":"Uživatelé",
               "Required":true,
               "Unique":null,
               "Safer":null,
               "Min":null,
               "Max":2,
               "OnDeleteAction":"protect"
            }
         ]
      },
      {
         "Name":"url3",
         "Description":null,
         "Attributes":[
            {
               "Name":"Měsíc",
               "Description":null,
               "Type":"Uživatelé",
               "Required":true,
               "Unique":null,
               "Safer":null,
               "Max":9,
               "OnDeleteAction":"setEmpty"
            },
            {
               "Name":"Uživatelé",
               "Description":null,
               "Type":"Uživatelé",
               "Required":true,
               "Unique":null,
               "Safer":null,
               "Min":1,
               "Max":null,
               "OnDeleteAction":"setEmpty"
            },
            {
               "Name":"url",
               "Description":null,
               "Type":"Uživatelé",
               "Required":null,
               "Unique":null,
               "Safer":null,
               "Min":7,
               "Max":null,
               "OnDeleteAction":"setEmpty"
            }
         ]
      }
   ]
}