{
   "ApplicationName":"test2",
   "LoginApplicationName":"test2",
   "DefaultLanguage":"en",
   "SystemDatasets":{
      "UsersDatasetDescriptor":{
         "Name":"Users{12}",
         "Description":"Dataset s uÅ¾ivateli aplikace.",
         "PasswordAttribute":{
            "Name":"Password",
            "Type":"password",
            "Required":true,
            "Min":-1,
            "Max":-1
         },
         "Attributes":[
            {
               "Name":"Usernam{23}e",
               "Type":"username",
               "Required":true,
               "Unique":true,
               "Min":-1,
               "Max":-1
            }
         ]
      }
   },
   "Datasets":[
      {
         "Name":"no min max valid",
         "Description":null,
         "Attributes":[
            {
               "Name":"Color",
               "Type":"color"
            },
            {
               "Name":"Date",
               "Type":"date"
            },
            {
               "Name":"Datetime",
               "Type":"datetime"
            },
            {
               "Name":"Email",
               "Type":"email",
               "Required":true
            },
            {
               "Name":"Month",
               "Type":"month"
            },
            {
               "Name":"Phone",
               "Type":"phone"
            },
            {
               "Name":"Time",
               "Type":"time"
            },
            {
               "Name":"Url",
               "Type":"url"
            },
            {
               "Name":"Bool",
               "Type":"bool"
            }
         ]
      },
      {
         "Name":"min max > 0 jen pro",
         "Attributes":[
            {
               "Name":"Text",
               "Type":"text",
               "Min":-1,
               "Max":-1,
               "Required":true
            },
            {
               "Name":"String",
               "Type":"string",
               "Min":-1,
               "Max":-1
            },
            {
               "Name":"Ref",
               "Type":"Users",
               "Min":-1,
               "Max":-1
            },
            {
               "Name":"Int",
               "Type":"int",
               "Min":-1,
               "Max":-1
            },
            {
               "Name":"Float",
               "Type":"float",
               "Min":-1,
               "Max":-1
            },
            {
               "Name":"Year",
               "Type":"year",
               "Min":-1,
               "Max":-1
            }
         ]
      }
   ]
}