{ 
  "LoginApplicationName":"all_ref_test",
  "ApplicationName":"all references test",
  "DefaultLanguage":"en",
  "SystemDatasets":
  {
    "UsersDatasetDescriptor":
    {
      "Name":"Uživatelé",
      "Description":"Dataset s uživateli aplikace.",
      "PasswordAttribute":
      {
        "Name":"Password",
        "Type":"password",
        "Safer":false
      },
      "Attributes":
      [
        {
          "Name":"Uživatelské jméno",
          "Type":"username"
        },
        {
          "Name":"Pozice",
          "Type":"Pozice"
        },
        {
          "Name":"Uživatel",
          "Type":"Uživatelé"
        }
      ]
    }
  },
  "Datasets": 
  [
    {
      "Name":"Pozice",
      "Attributes": 
      [
        {
          "Name":"Název pozice",
          "Type":"string"
        }
      ]
    },
    {
      "Name":"Měsíce",
      "Attributes": 
      [
        {
          "Name":"Jméno měsíce",
          "Type":"string"
        }
      ]
    },
    {
      "Name":"Narozeniny",
      "Attributes": 
      [
        {
          "Name":"Měsíc",
          "Type":"Měsíce"
        },
        {
          "Name":"Uživatelé",
          "Type":"Uživatelé"
        }
      ]
    }
  ]
}